{
  "$schema": "https://json-schema.org/draft/2020-12/schema",
  "$id": "https://estudio-interactivo.local/schema/study-module.schema.json",
  "title": "Estudio Interactivo portable study snapshot v1",
  "type": "object",
  "additionalProperties": false,
  "required": ["schemaVersion", "module", "questions", "progress"],
  "properties": {
    "schemaVersion": { "const": 1 },
    "module": { "$ref": "#/$defs/module" },
    "questions": {
      "type": "array",
      "minItems": 1,
      "maxItems": 5000,
      "items": { "$ref": "#/$defs/question" }
    },
    "progress": { "$ref": "#/$defs/progress" }
  },
  "$defs": {
    "id": {
      "type": "string",
      "pattern": "^[a-z0-9][a-z0-9._-]{0,63}$"
    },
    "counter": {
      "type": "integer",
      "minimum": 0,
      "maximum": 9007199254740990
    },
    "positiveRevision": {
      "type": "integer",
      "minimum": 1,
      "maximum": 9007199254740990
    },
    "timestamp": {
      "type": "string",
      "pattern": "^[0-9]{4}-[0-9]{2}-[0-9]{2}T[0-9]{2}:[0-9]{2}:[0-9]{2}(?:\\.[0-9]+)?Z$"
    },
    "module": {
      "type": "object",
      "additionalProperties": false,
      "required": [
        "id",
        "contentRevision",
        "title",
        "subject",
        "description",
        "language",
        "createdAt",
        "updatedAt"
      ],
      "properties": {
        "id": { "$ref": "#/$defs/id" },
        "contentRevision": { "$ref": "#/$defs/positiveRevision" },
        "title": { "type": "string", "minLength": 1, "maxLength": 120 },
        "subject": { "type": "string", "minLength": 1, "maxLength": 120 },
        "description": { "type": "string", "maxLength": 1000 },
        "language": {
          "type": "string",
          "minLength": 2,
          "maxLength": 35,
          "pattern": "^[A-Za-z]{2,8}(?:-[A-Za-z0-9]{1,8})*$"
        },
        "createdAt": { "$ref": "#/$defs/timestamp" },
        "updatedAt": { "$ref": "#/$defs/timestamp" }
      }
    },
    "option": {
      "type": "object",
      "additionalProperties": false,
      "required": ["id", "text"],
      "properties": {
        "id": { "$ref": "#/$defs/id" },
        "text": { "type": "string", "minLength": 1, "maxLength": 2000 }
      }
    },
    "source": {
      "type": "object",
      "additionalProperties": false,
      "required": ["label"],
      "properties": {
        "label": { "type": "string", "minLength": 1, "maxLength": 300 },
        "reference": { "type": "string", "minLength": 1, "maxLength": 500 }
      }
    },
    "questionTable": {
      "type": "object",
      "additionalProperties": false,
      "required": ["kind", "caption", "columns", "rows"],
      "properties": {
        "kind": { "const": "table" },
        "caption": { "type": "string", "minLength": 1, "maxLength": 300, "pattern": "[^\\s\\u0000-\\u001F\\u007F-\\u009F\\u00AD\\u034F\\u061C\\u115F\\u1160\\u17B4\\u17B5\\u180B-\\u180F\\u200B-\\u200F\\u202A-\\u202E\\u2060-\\u206F\\u3164\\uFE00-\\uFE0F\\uFEFF\\uFFA0\uDB40\uDC00-\uDB43\uDFFF]" },
        "columns": {
          "type": "array",
          "minItems": 1,
          "maxItems": 12,
          "items": { "type": "string", "minLength": 1, "maxLength": 120, "pattern": "[^\\s\\u0000-\\u001F\\u007F-\\u009F\\u00AD\\u034F\\u061C\\u115F\\u1160\\u17B4\\u17B5\\u180B-\\u180F\\u200B-\\u200F\\u202A-\\u202E\\u2060-\\u206F\\u3164\\uFE00-\\uFE0F\\uFEFF\\uFFA0\uDB40\uDC00-\uDB43\uDFFF]" }
        },
        "rows": {
          "type": "array",
          "minItems": 1,
          "maxItems": 50,
          "items": {
            "type": "array",
            "minItems": 1,
            "maxItems": 12,
            "items": { "type": "string", "maxLength": 500 }
          }
        },
        "rowHeaderColumn": { "type": "integer", "minimum": 0, "maximum": 11 }
      }
    },
    "questionMedia": {
      "type": "object",
      "additionalProperties": false,
      "required": ["kind", "dataUri", "alt", "width", "height"],
      "properties": {
        "kind": { "enum": ["image", "diagram"] },
        "dataUri": {
          "type": "string",
          "maxLength": 699075,
          "pattern": "^data:image\\/(?:png|jpeg|webp);base64,[A-Za-z0-9+/]+={0,2}$"
        },
        "alt": { "type": "string", "minLength": 1, "maxLength": 500, "pattern": "[^\\s\\u0000-\\u001F\\u007F-\\u009F\\u00AD\\u034F\\u061C\\u115F\\u1160\\u17B4\\u17B5\\u180B-\\u180F\\u200B-\\u200F\\u202A-\\u202E\\u2060-\\u206F\\u3164\\uFE00-\\uFE0F\\uFEFF\\uFFA0\uDB40\uDC00-\uDB43\uDFFF]" },
        "caption": { "type": "string", "minLength": 1, "maxLength": 500, "pattern": "[^\\s\\u0000-\\u001F\\u007F-\\u009F\\u00AD\\u034F\\u061C\\u115F\\u1160\\u17B4\\u17B5\\u180B-\\u180F\\u200B-\\u200F\\u202A-\\u202E\\u2060-\\u206F\\u3164\\uFE00-\\uFE0F\\uFEFF\\uFFA0\uDB40\uDC00-\uDB43\uDFFF]" },
        "width": { "type": "integer", "minimum": 1, "maximum": 8192 },
        "height": { "type": "integer", "minimum": 1, "maximum": 8192 }
      }
    },
    "questionContentBlock": {
      "oneOf": [
        { "$ref": "#/$defs/questionTable" },
        { "$ref": "#/$defs/questionMedia" }
      ]
    },
    "question": {
      "type": "object",
      "additionalProperties": false,
      "required": [
        "id",
        "revision",
        "difficulty",
        "topic",
        "prompt",
        "options",
        "correctOptionId",
        "explanation"
      ],
      "properties": {
        "id": { "$ref": "#/$defs/id" },
        "revision": { "$ref": "#/$defs/positiveRevision" },
        "difficulty": {
          "enum": ["facil", "medio", "dificil", "experto"]
        },
        "topic": { "type": "string", "minLength": 1, "maxLength": 120 },
        "prompt": { "type": "string", "minLength": 1, "maxLength": 5000 },
        "body": { "type": "string", "minLength": 1, "maxLength": 5000, "pattern": "[\\p{L}\\p{N}\\p{P}\\p{S}]" },
        "options": {
          "type": "array",
          "minItems": 2,
          "maxItems": 8,
          "items": { "$ref": "#/$defs/option" }
        },
        "correctOptionId": { "$ref": "#/$defs/id" },
        "explanation": { "type": "string", "minLength": 1, "maxLength": 5000 },
        "source": { "$ref": "#/$defs/source" },
        "supportingContent": {
          "type": "array",
          "minItems": 1,
          "maxItems": 4,
          "items": { "$ref": "#/$defs/questionContentBlock" }
        }
      }
    },
    "optionAnswer": {
      "type": "object",
      "additionalProperties": false,
      "required": ["kind", "optionId"],
      "properties": {
        "kind": { "const": "option" },
        "optionId": { "$ref": "#/$defs/id" }
      }
    },
    "dontKnowAnswer": {
      "type": "object",
      "additionalProperties": false,
      "required": ["kind"],
      "properties": {
        "kind": { "const": "dontKnow" }
      }
    },
    "answer": {
      "oneOf": [
        { "$ref": "#/$defs/optionAnswer" },
        { "$ref": "#/$defs/dontKnowAnswer" }
      ]
    },
    "nullableAnswer": {
      "oneOf": [
        { "type": "null" },
        { "$ref": "#/$defs/answer" }
      ]
    },
    "questionProgress": {
      "type": "object",
      "additionalProperties": false,
      "required": [
        "questionRevision",
        "attempts",
        "correct",
        "lastResult",
        "lastAnswer",
        "lastSubmittedAt",
        "lastCompletedStateRevision"
      ],
      "properties": {
        "questionRevision": { "$ref": "#/$defs/positiveRevision" },
        "attempts": { "$ref": "#/$defs/counter" },
        "correct": { "$ref": "#/$defs/counter" },
        "lastResult": {
          "oneOf": [
            { "enum": ["correct", "incorrect"] },
            { "type": "null" }
          ]
        },
        "lastAnswer": { "$ref": "#/$defs/nullableAnswer" },
        "lastSubmittedAt": {
          "oneOf": [
            { "$ref": "#/$defs/timestamp" },
            { "type": "null" }
          ]
        },
        "lastCompletedStateRevision": {
          "oneOf": [
            { "$ref": "#/$defs/positiveRevision" },
            { "type": "null" }
          ]
        }
      }
    },
    "runFilters": {
      "type": "object",
      "additionalProperties": false,
      "required": ["difficulty", "population", "requestedSize", "acceptedSize"],
      "properties": {
        "difficulty": {
          "enum": ["facil", "medio", "dificil", "experto", "mixta"]
        },
        "population": { "enum": ["nuevas", "todas"] },
        "requestedSize": { "type": "integer", "minimum": 1, "maximum": 5000 },
        "acceptedSize": { "type": "integer", "minimum": 1, "maximum": 5000 },
        "topicQuotas": {
          "type": "array",
          "minItems": 1,
          "maxItems": 5000,
          "items": { "$ref": "#/$defs/topicQuota" }
        }
      }
    },
    "topicQuota": {
      "type": "object",
      "additionalProperties": false,
      "required": ["topic", "count"],
      "properties": {
        "topic": { "type": "string", "minLength": 1, "maxLength": 120 },
        "count": { "type": "integer", "minimum": 1, "maximum": 5000 }
      }
    },
    "runItem": {
      "type": "object",
      "additionalProperties": false,
      "required": ["questionId", "questionRevision", "optionOrder", "answer"],
      "properties": {
        "questionId": { "$ref": "#/$defs/id" },
        "questionRevision": { "$ref": "#/$defs/positiveRevision" },
        "optionOrder": {
          "type": "array",
          "minItems": 2,
          "maxItems": 8,
          "items": { "$ref": "#/$defs/id" }
        },
        "answer": { "$ref": "#/$defs/nullableAnswer" }
      }
    },
    "activeRun": {
      "type": "object",
      "additionalProperties": false,
      "required": [
        "id",
        "createdStateRevision",
        "completedStateRevision",
        "startedAt",
        "seed",
        "filters",
        "coverageBeforeCount",
        "items",
        "status",
        "submittedAt",
        "currentIndex"
      ],
      "properties": {
        "id": { "$ref": "#/$defs/id" },
        "createdStateRevision": { "$ref": "#/$defs/positiveRevision" },
        "completedStateRevision": { "type": "null" },
        "startedAt": { "$ref": "#/$defs/timestamp" },
        "seed": { "type": "integer", "minimum": 0, "maximum": 4294967295 },
        "filters": { "$ref": "#/$defs/runFilters" },
        "coverageBeforeCount": { "type": "integer", "minimum": 0, "maximum": 5000 },
        "items": {
          "type": "array",
          "minItems": 1,
          "maxItems": 5000,
          "items": { "$ref": "#/$defs/runItem" }
        },
        "status": { "const": "active" },
        "submittedAt": { "type": "null" },
        "currentIndex": { "type": "integer", "minimum": 0, "maximum": 4999 }
      }
    },
    "completedRun": {
      "type": "object",
      "additionalProperties": false,
      "required": [
        "id",
        "createdStateRevision",
        "completedStateRevision",
        "startedAt",
        "seed",
        "filters",
        "coverageBeforeCount",
        "items",
        "status",
        "submittedAt",
        "correctCount",
        "incorrectCount",
        "coverageAfterCount"
      ],
      "properties": {
        "id": { "$ref": "#/$defs/id" },
        "createdStateRevision": { "$ref": "#/$defs/positiveRevision" },
        "completedStateRevision": { "$ref": "#/$defs/positiveRevision" },
        "startedAt": { "$ref": "#/$defs/timestamp" },
        "seed": { "type": "integer", "minimum": 0, "maximum": 4294967295 },
        "filters": { "$ref": "#/$defs/runFilters" },
        "coverageBeforeCount": { "type": "integer", "minimum": 0, "maximum": 5000 },
        "items": {
          "type": "array",
          "minItems": 1,
          "maxItems": 5000,
          "items": { "$ref": "#/$defs/runItem" }
        },
        "status": { "const": "completed" },
        "submittedAt": { "$ref": "#/$defs/timestamp" },
        "correctCount": { "type": "integer", "minimum": 0, "maximum": 5000 },
        "incorrectCount": { "type": "integer", "minimum": 0, "maximum": 5000 },
        "coverageAfterCount": { "type": "integer", "minimum": 0, "maximum": 5000 }
      }
    },
    "difficultySummary": {
      "type": "object",
      "additionalProperties": false,
      "required": ["attempts", "correct"],
      "properties": {
        "attempts": { "$ref": "#/$defs/counter" },
        "correct": { "$ref": "#/$defs/counter" }
      }
    },
    "priorRunSummary": {
      "type": "object",
      "additionalProperties": false,
      "required": [
        "runCount",
        "attemptCount",
        "correctCount",
        "firstSubmittedAt",
        "lastSubmittedAt",
        "byDifficulty"
      ],
      "properties": {
        "runCount": { "$ref": "#/$defs/counter" },
        "attemptCount": { "$ref": "#/$defs/counter" },
        "correctCount": { "$ref": "#/$defs/counter" },
        "firstSubmittedAt": {
          "oneOf": [
            { "$ref": "#/$defs/timestamp" },
            { "type": "null" }
          ]
        },
        "lastSubmittedAt": {
          "oneOf": [
            { "$ref": "#/$defs/timestamp" },
            { "type": "null" }
          ]
        },
        "byDifficulty": {
          "type": "object",
          "additionalProperties": false,
          "required": ["facil", "medio", "dificil", "experto"],
          "properties": {
            "facil": { "$ref": "#/$defs/difficultySummary" },
            "medio": { "$ref": "#/$defs/difficultySummary" },
            "dificil": { "$ref": "#/$defs/difficultySummary" },
            "experto": { "$ref": "#/$defs/difficultySummary" }
          }
        }
      }
    },
    "progress": {
      "type": "object",
      "additionalProperties": false,
      "required": [
        "updatedAt",
        "stateRevision",
        "questions",
        "runs",
        "priorRunSummary",
        "activeRun"
      ],
      "properties": {
        "updatedAt": { "$ref": "#/$defs/timestamp" },
        "stateRevision": { "$ref": "#/$defs/counter" },
        "questions": {
          "type": "object",
          "propertyNames": { "$ref": "#/$defs/id" },
          "additionalProperties": { "$ref": "#/$defs/questionProgress" }
        },
        "runs": {
          "type": "array",
          "maxItems": 500,
          "items": { "$ref": "#/$defs/completedRun" }
        },
        "priorRunSummary": { "$ref": "#/$defs/priorRunSummary" },
        "activeRun": {
          "oneOf": [
            { "type": "null" },
            { "$ref": "#/$defs/activeRun" }
          ]
        }
      }
    }
  }
}
