{"module":{"contentRevision":1,"createdAt":"2026-09-06T18:00:00Z","description":"Banco original y sintético para probar Estudio Interactivo. No deriva de material oficial ni de las materias descargadas.","id":"fundamentos-estudio-razonamiento-visual","language":"es-AR","subject":"Fundamentos de estudio y razonamiento","title":"Módulo sintético inicial","updatedAt":"2026-09-06T18:00:00Z"},"progress":{"activeRun":null,"priorRunSummary":{"attemptCount":0,"byDifficulty":{"dificil":{"attempts":0,"correct":0},"experto":{"attempts":0,"correct":0},"facil":{"attempts":0,"correct":0},"medio":{"attempts":0,"correct":0}},"correctCount":0,"firstSubmittedAt":null,"lastSubmittedAt":null,"runCount":0},"questions":{},"runs":[],"stateRevision":0,"updatedAt":"2026-09-06T18:00:00Z"},"questions":[{"correctOptionId":"a","difficulty":"facil","explanation":"La recuperación activa obliga a traer la información desde la memoria. Releer puede producir familiaridad, pero no comprueba que la idea pueda recuperarse sin ayuda.","id":"fundamentos-estudio-razonamiento-visual.facil.001","options":[{"id":"a","text":"Intentar reconstruir una idea de memoria antes de consultar los apuntes"},{"id":"b","text":"Releer el mismo párrafo varias veces sin cerrar el material"},{"id":"c","text":"Subrayar cada término que parezca importante"},{"id":"d","text":"Copiar literalmente el texto para conservar su redacción"}],"prompt":"¿Qué acción representa mejor la recuperación activa durante el estudio?","revision":1,"source":{"label":"Banco sintético original (sin material de cursos)","reference":"Fundamentos de estudio y razonamiento · Recuperación activa"},"supportingContent":[{"alt":"A la izquierda hay una hoja de apuntes; una flecha apunta a una tarjeta separada que representa recordar sin mirar.","caption":"Separar los apuntes del intento obliga a recuperar la idea desde la memoria.","dataUri":"data:image/png;base64,iVBORw0KGgoAAAANSUhEUgAAAtAAAAFoCAYAAAB+JswZAAAadElEQVR4nO3dzY1mhRWE4c6IkAjAGTghUnAGbLxgDztvLJkAkIVky5ZXFj0a6J+quucpqfatuu989+XwzfTLL//89V9qAwxgAAMYwAAGMIABDHwdAy+G8ocFAxjAAAYwgAEMYAADX88AgfYHxh8YDGAAAxjAAAYwgAECDQIfBBjAAAYwgAEMYAADH8OAC7Q/XP5wYQADGMAABjCAAQwQaBD4IMAABjCAAQxgAAMYcIEGgQ8CDGAAAxjAAAYwgIE4A77CAcI4hGoDDGAAAxjAAAaWGCDQBQ9BbYABDGAAAxjAAAZ2GCDQBQ9BbYABDGAAAxjAAAZ2GCDQBQ9BbYABDGAAAxjAAAZ2GCDQBQ9BbYABDGAAAxjAAAZ2GCDQBQ9BbYABDGAAAxjAAAZ2GCDQBQ9BbYABDGAAAxjAAAZ2GCDQBQ9BbYABDGAAAxjAAAZ2GCDQBQ9BbYABDGAAAxjAAAZ2GCDQBQ9BbYABDGAAAxjAAAZ2GCDQBQ9BbYABDGAAAxjAAAZ2GCDQBQ9BbYABDGAAAxjAAAZ2GCDQBQ9BbYABDGAAAxjAAAZ2GCDQBQ9BbYABDGAAAxjAAAZ2GCDQBQ9BbYABDGAAAxjAAAZ2GCDQBQ9BbYABDGAAAxjAAAZ2GCDQBQ9BbYABDGAAAxjAAAZ2GCDQBQ9BbYABDGAAAxjAAAZ2GCDQBQ9BbYABDGAAAxjAAAZ2GCDQBQ9BbYABDGAAAxjAAAZ2GCDQBQ9BbYABDGAAAxjAAAZ2GCDQBQ9BbYABDGAAAxjAAAZ2GCDQBQ9BbYABDGAAAxjAAAZ2GCDQBQ9BbYABDGAAAxjAAAZ2GCDQBQ9BbYABDGAAAxjAAAZ2GCDQBQ9BbYABDGAAAxjAAAZ2GCDQBQ9BbYABDGAAAxjAAAZ2GCDQBQ9BbYABDGAAAxjAAAZ2GCDQBQ9BbYABDGAAAxjAAAZ2GCDQBQ9BbYABDGAAAxjAAAZ2GCDQBQ9BbYABDGAAAxjAAAZ2GCDQBQ9BbYABDGAAAxjAAAZ2GCDQBQ9BbYABDGAAAxjAAAZ2GCDQBQ9BbYABDGAAAxjAAAZ2GCDQBQ9BbYABDGAAAxjAAAZ2GCDQBQ9BbYABDGAAAxjAAAZ2GCDQBQ9BbYABDGAAAxjAAAZ2GCDQBQ9BbYABDGAAAxjAAAZ2GCDQBQ9BbYABDGAAAxjAAAZ2GCDQBQ9BbYABDGAAAxjAAAZ2GCDQBQ9BbYABDGAAAxjAAAZ2GCDQBQ9BbYABDGAAAxjAAAZ2GCDQBQ9BbYABDGAAAxjAAAZ2GCDQBQ9BbYABDGAAAxjAAAZ2GCDQBQ9BbYABDGAAAxjAAAZ2GCDQBQ9BbYABDGAAAxjAAAZ2GCDQBQ9BbYABDGAAAxjAAAZ2GCDQBQ9BbYABDGAAAxjAAAZ2GCDQBQ9BbYABDGAAAxjAAAZ2GDgj0N//8KPaAAMY+F0MpD+31AYYwAAGOhkg0ISCVGIAAwQ6/jJSG2AAA0sMEGjyRJ4wgAECHX8ZqQ0wgIElBgg0eSJPGMAAgY6/jNQGGMDAEgMEmjyRJwxggEDHX0ZqAwxgYIkBAk2eyBMGMECg4y8jtQEGMLDEwHmBFhEh0PmXkdoAAxhYYoBAi8j5EOj8y0htgAEMLDFAoEXkfAh0/mWkNsAABpYYINAicj4EOv8yUhtgAANLDBBoETkfAp1/GakNMICBJQYItIicD4HOv4zUBhjAwBIDBFpEzodA519GagMMYGCJAQItIudDoPMvI7UBBjCwxACBFpHzIdD5l5HaAAMYWGKAQIvI+RDo/MtIbYABDCwxQKBF5HwIdP5lpDbAAAaWGCDQInI+BDr/MlIbYAADSwwQaBE5HwKdfxmpDTCAgSUGCLSInA+Bzr+M1AYYwMASAwRaRM6HQOdfRmoDDGBgiQECLSLnQ6DzLyO1AQYwsMQAgRaR8yHQX/fC+Obb79QGGMDAfxlIC2y6BFpEzodAE2hSRIwx8PsYSAtsugRaRM6HQBNo8kSgMUCgCfRvvAxee0GKiBBoAk2eCDQGCDSBJtAi8jtCoAk0eSLQGCDQBJpAiwiBfvfv/BEMkokBDPgOtO9A+wqHiLhAE2hSSAox8AcYSP8lvnT9JUIROR9f4Xj7Bfqnv/+iNsDAwxgg0ATaXyIUEd+B/sCvcKRf9GoDDBBoF+gPOLX7VzhExF8iJNAki2hjwAXaVzgItIi8Q3yFwwWaVBFrDPgKh+9Au0CLCIF+9/+T5yscJJNk3mLAd6B9B9pXOETEBZpAx4VEbbDEAIEm0ARaRAg0gY4LidpgiQECTaAJtIgQaAIdFxK1wRIDBJpAE2gRIdAEOi4kaoMlBgg0gSbQIkKgCXRcSNQGSwwQaAJNoEWEQBPouJCoDZYYINAEmkCLCIEm0HEhURssMUCgCTSBFhECTaDjQqI2WGKAQBNoAi0iBJpAx4VEbbDEAIEm0ARaRAg0gY4LidpgiQECTaAJtIgQaAIdFxK1wRIDBJpAE2gRIdAEOi4kaoMlBgg0gSbQIkKgCXRcSNQGSwwQaAJNoEWEQBPouJCoDZYYINAEuk6g//LXf6gNMPA/BtJ57fPhrcL5tH7pZZp+0asNMECgP/Pz8CX9gfxZJdBkjbD3MpAOgSbQ5IuAY8AFmkAT6LgQqQ0I9PPqAk0ySeYtBnyFwwXaBZrQkfpiBtJxgSbQaVFRGzQyQKAJNIEukCS1AYHOX5FdoPNSojZYYYBAE2gCTd4IfDED6bhAu0CnRUVt0MgAgSbQBLpAktQGBDp/RXaBzkuJ2mCFAQJNoAk0eSPwxQyk4wLtAp0WFbVBIwMEmkAT6AJJUhsQ6PwV2QU6LyVqgxUGCDSBJtDkjcAXM5COC7QLdFpU1AaNDBBoAk2gCyRJbUCg81dkF+i8lKgNVhgg0ASaQJM3Al/MQDou0C7QaVFRGzQyQKAJNIEukCS1AYHOX5FdoPNSojZYYYBAE2gCTd4IfDED6bhAu0CnRUVt0MgAgSbQBLpAktQGBDp/RXaBzkuJ2mCFAQJNoAk0eSPwxQyk4wLtAp0WFbVBIwMEmkAT6AJJUhsQ6PwV2QU6LyVqgxUGCDSBJtDkjcAXM5COC7QLdFpU1AaNDBBoAl0n0CLSEwJNoNOiojZoZIBAE2gCLSIE2lc44kKiNlhigEATaAItIgSaQMeFRG2wxACBJtAEWkQINIGOC4naYIkBAk2gCbSIEGgCHRcStcESAwSaQBNoESHQBDouJGqDJQYINIEm0CJCoAl0XEjUBksMEGgCTaBFhEAT6LiQqA2WGCDQBJpAiwiBJtBxIVEbLDFAoAk0gRYRAk2g40KiNlhigEATaAItIgT6iEB/6edUG7QzkP7zQ6C/7vPw5a0fqCv1q7xFxK/yJtBpOVIbEOhnlECLyPm89h/Y6Q/otj7haqY2aGcg/efHBZpAu0CLyFeFQBPotDSpDQh0/kjgAv0bI/gKh4gQaBdookpU2xlIX51doF2gCbSIuED7CkdciNQGBDp/MXaB/oMjuECLiAu0CzSZJbPtDKSvzi7QLtAEWkRcoF2g40KkNiDQ+YuxC7QLtIi8c/wlQn+JkOSS3BYG0ldnF2gXaBdoESHQLtBxIVIbEOj8xdgF2gVaRFygIy+MJ1zN1AbtDKT//LhAu0C7QIuICzSBjguR2oBA5y/GLtAu0CLiAu0C7QJNzB8q5umrswu0C7QLtIi4QLtAx4VIbUCg8xdjF2gXaBFxgXaBdoEm5g8V8/TV2QXaBdoFWkRcoF2g40KkNiDQ+YuxC7QLtIi4QLtAu0AT84eKefrq7ALtAu0CLSIu0C7QcSFSGxDo/MXYBdoFWkRcoF2gC65zaoOnM/Al8U8LbLov6R/gs/rar+oVEfGrvL/uc3TlfzurDTBAoAk0gRaRDw6BJtCEi3RjwAXaBdoFWkQI9LtfYFygSSbJvMWAr3D4CkfdVzh++tvPaoMaBq7HBZpAp0VFbdDIAIEm0AS6QNK0d4PrIdAEOi0qaoNGBgg0gSbQBZKmvRtcD4Em0GlRURs0MkCgCTSBLpA07d3gegg0gU6LitqgkQECTaAJdIGkae8G10OgCXRaVNQGjQwQaAJNoAskTXs3uB4CTaDToqI2aGSAQBNoAl0gadq7wfUQaAKdFhW1QSMDBJpAE+gCSdPeDa6HQBPotKioDRoZINAEmkAXSJr2bnA9BJpAp0VFbdDIAIEm0AS6QNK0d4PrIdAEOi0qaoNGBgg0gSbQBZKmvRtcT7NA/+cFlv4Z/CrvvMioDQh0V1/SP8Bn1a/yzkua9m5wPe0C3SLRX7pGETyCh4HnMeACTaAJdIGkae8G17Mg0A0iTaDzQqM2INAddYEWkfNZEuikRBNo8kbgbzHgAk2g6y7QItKTNYFOiTSBzguN2oBAd9QFWkTOZ1WgP1uiCTR5I/C3GGj57GksgRaR81kW6M98mRHovNCoDQh0/nOZQPsKh4gMf4XjsyWaQJM3An+LgfR/tDfXBVpEzucpAv3RLzYCnRcatQGBzn8uE2gXaBF50AX6oyWaQJM3An+LARdoAu1f4RCRx/0rHJ8t0gQ6LzRqAwLdUV/hEJHzebJAv6dEE2jyRuBvMeACTaBdoEXkwy/Q7yG7H1kCnRcStcESAwSaQBNoETkv0G+VaBfovNCoDQh0/v8M+gqHv0QoIocu0G+9RhNo8kbgbzHgAk2gXaBFxAX6jRJNoPNCozYg0Pnrswu0C7SIHL1A/xGJJtDkjcDfYsAFmkC7QIuIC7QLdFxI1AZLDBBoAk2gRYRA+w50XEjUBksMEGgCTaBFhED7VzjiQqI2WGKAQBNoAi0i5wX6rX9pZuU70N/+6c96cIM0d08sgSbQBFpETv4q77denQl0XgyVQBPo/Gexf4Xj/16QIiJPFujP+lnSlzIXaKKd5u6JdYEm0C7QInLqAv3ZP0v6RU+gCXSauyeWQBNoAi0iZwQ68bOkX/QEmkCnuXtiCTSBJtAi8niBTv4s6Rc9gSbQae6eWAJNoAm0iDxaoNM/S/pFT6AJdJq7Jzb9mdPcl/QP8Fl97QUpIrIs0C0/S/pFT6AJdJq7J7bls6exBFpEzmdVoJt+lvSLnkAT6DR3T2zT509bCbSInM+aQDf9LASauLb8O9Vp2XxiCTSBrvsKx09/+1lt8GgGlrIk0E0/C4HOS6MSaAKd+Tx0gQ4lLTdqAwK9JdDpn4NAk9V2WU9fa59YF2gC7QJNGP1Hgwv0rECnfwYCnZdDJdAEuqsu0KEQWkL7dAaW0izQTV35CofaAAMu0AT6nT74fQc6L1R6a4OlEGgCTbhINwZ8hcMFmkDH5UltsBQCTaDJE4HGAIEm0ASawBLYOANLIdAEmjwRaAwQaAJNoOPypDZYCoEm0OSJQGOAQBNoAk1gCWycgaUQaAJNngg0Bgg0gSbQcXlSGyyFQBNo8kSgMUCgCTSBJrAENs7AUgg0gSZPBBoDBJpAE+i4PKkNlkKgCTR5ItAYINAEmkATWAIbZ2ApBJpAkycCjQECTaAHBFpEekKgCTR5ItAYINAEmkCLCIH2q7xJISnEwJsY+Obb717tR/+q7Pa+pH+Az6oLtIi4QL/tc/RLL1OiQlYx8DwGCDSBJtAiQqAJdFxI1AZLDBBoAk2gRYRAE+i4kKgNlhgg0ASaQIsIgSbQcSFRGywxQKAJNIEWEQJNoONCojZYYoBAE2gCLSIEmkDHhURtsMQAgSbQBFpECDSBjguJ2mCJAQJNoAm0iBBoAh0XErXBEgMEmkATaBEh0AQ6LiRqgyUGCDSBJtAiQqAJdFxI1AZLDBBoAk2gRYRAE+i4kKgNlhgg0ASaQIsIgSbQcSFRGywxQKAJNIEWEQJNoONCojZYYoBAE2gCLSIEmkDHhURtsMQAgSbQBFpECDSBjguJ2mCJAQJNoAm0iBBoAh0XErXBEgMEmkATaBEh0AQ6LiRqgyUGCDSBJtAiQqAJdFxI1AZLDBBoAk2gRYRAE+i4kKgNlhgg0ASaQIsIgSbQcSFRGywxQKAJNIEWEQJNoONCojZYYoBAE2gCLSIEmkDHhURtsMQAgSbQBFpECDSBjguJ2mCJAQJNoAm0iBBoAh0XErXBEgMEmkATaBEh0AQ6LiRqgyUGCDSBJtAiQqAJdFxI1AZLDBBoAk2gRYRAE+i4kKgNlhgg0ASaQIsIgSbQcSFRGywxQKAJNIEWEQJNoONCojZYYoBAE2gCLSIEmkDHhURtsMQAgSbQBFpECDSBjguJ2mCJAQJNoAm0iBBoAh0XErXBEgMEmkATaBEh0AQ6LiRqgyUGCDSBJtAiQqAJdFxI1AZLDBBoAk2gRYRAE+i4kKgNlhgg0ASaQIsIgSbQcSFRGywxQKAJNIEWEQJNoONCojZYYoBAE2gCLSIEmkDHhURtsMQAgSbQBFpECDSBjguJ2mCJAQJNoAm0iBBoAh0XErXBEgMEmkATaBEh0AQ6LiRqgyUGCDSBJtAiQqAJdFxI1AZLDBBoAk2gRYRAE+i4kKgNlhgg0ASaQIsIgSbQcSFRGywxQKAJNIEWEQJNoONCojZYYoBAE2gCLSIEmkDHhURtsMQAgSbQBFpECDSBjguJ2mCJAQJNoAm0iBBoAh0XErXBEgMEmkATaBEh0AQ6LiRqgyUGCDSBJtAiQqAJdFxI1AZLDBBoAk2gRYRAE+i4kKgNlhgg0ASaQIsIgSbQcSFRGywxQKAJNIEWEQJNoONCojZYYoBAE2gCLSIEmkDHhURtsMQAgSbQBFpECDSBjguJ2mCJAQJNoAm0iBBoAh0XErXBEgMEmkATaBEh0AQ6LiRqgyUGCDSBJtAiQqAJdFxI1AZLDBBoAk2gRYRAE+i4kKgNlhgg0ASaQIsIgSbQcSFRGywxQKAJNIEWEQJNoONCojZYYoBAE2gCLSIEmkDHhURtsMQAgSbQBFpECDSBjguJ2mCJAQJNoAm0iBBoAh0XErXBEgMEmkATaBEh0AQ6LiRqgyUGCDSBJtAiQqAJdFxI1AZLDBBoAk2gRYRAf6BAqw0wcIuBt36erPcl/QN8Vr//4cffrIjIa58P6c+ttqZf2GoDDPQwkP48SpdAi8j5EGgCnZYRtcEaA2mBTZdAi8j5EGgCnZYRtcEaA2mBTZdAi8j5EGgCnZYRtcEaA2mBTZdAi8j5EGgCnZYRtcEaA2mBTZdAi8j5EGgCnZYRtcEaA2mBTZdAi8j5EOj8y0htgAEMLDFAoEXkfAh0/mWkNsAABpYYINAicj4EOv8yUhtgAANLDBBoETkfAp1/GakNMICBJQYItIicD4HOv4zUBhjAwBIDBFpEzodA519GagMMYGCJAQItIudDoPMvI7UBBjCwxACBFpHzIdD5l5HaAAMYWGKAQIvI+RDo/MtIbYABDCwxQKBF5HwIdP5lpDbAAAaWGCDQInI+BDr/MlIbYAADSwwQaBE5HwKdfxmpDTCAgSUGCLSInA+Bzr+M1AYYwMASAwRaRM6HQOdfRmoDDGBgiQECLSLnQ6DzLyO1AQYwsMQAgRaR8yHQ+ZeR2gADGFhi4LxAv/biVBtgAAPpD2i1AQYwgIFOBgg0SSCKGMDAKwykP6DVBhjAAAY6GSDQ5Ik8YQADBDr+MlIbYAADSwwQaPJEnjCAAQIdfxmpDTCAgSUGCDR5Ik8YwACBjr+M1AYYwMASAwSaPJEnDGCAQMdfRmoDDGBgiYEzAq02wAAGMIABDGAAAxgg0CDwQYABDGAAAxjAAAYw4AINAh8EGMAABjCAAQxgAAO9DPgKR8FDUBtgAAMYwAAGMICBHQYIdMFDUBtgAAMYwAAGMICBHQYIdMFDUBtgAAMYwAAGMICBHQYIdMFDUBtgAAMYwAAGMICBHQYIdMFDUBtgAAMYwAAGMICBHQYIdMFDUBtgAAMYwAAGMICBHQYIdMFDUBtgAAMYwAAGMICBHQYIdMFDUBtgAAMYwAAGMICBHQYIdMFDUBtgAAMYwAAGMICBHQYIdMFDUBtgAAMYwAAGMICBHQYIdMFDUBtgAAMYwAAGMICBHQYIdMFDUBtgAAMYwAAGMICBHQYIdMF